{
  "dispositions": [
    {
      "disposition": "addressed",
      "finding_index": 0
    },
    {
      "disposition": "unresolved",
      "finding_index": 1
    },
    {
      "disposition": "unresolved",
      "finding_index": 2
    },
    {
      "disposition": "addressed",
      "finding_index": 3
    }
  ],
  "instrument": {
    "capture_version": "0.2.0",
    "fence": "2026-10-28-ci-live-cc-2-1-312"
  },
  "judged_at": "2026-10-28T13:23:32Z",
  "judgement_id": "ci-40689981547-12817211017-disposition-20261028T132332Z",
  "oracle": {
    "calibration": {
      "result": "none",
      "status": "not-run",
      "suite": "none"
    },
    "id": "review-disposition",
    "version": "rest-v1"
  },
  "outcome": "UNKNOWN",
  "run_id": "ci-40689981547-12817211017"
}
